{
  "taskType": "publish_from_spu",
  "taskId": "shop-001-product-001-flow",
  "runtimeDir": "C:\\Users\\ffc\\.openclaw\\workspace\\douyin-title-generator\\data\\tasks\\shop-001-product-001-flow",
  "resultFile": "C:\\Users\\ffc\\.openclaw\\workspace\\douyin-title-generator\\data\\tasks\\shop-001-product-001-flow\\result.json",
  "input": {
    "shopFolder": "C:\\path\\to\\shop-folder",
    "productFolder": "C:\\path\\to\\shop-folder\\001-product-folder",
    "mode": "run_publish_flow",
    "metadata": {
      "brand": "品牌名",
      "spu": "SPU信息",
      "title": "商品标题",
      "shortTitle": "导购短标题",
      "modelSpec": "盒装"
    },
    "headless": false,
    "retryOnSystemError": true
  }
}
