{
    "input":  {
                  "metadata":  {
                                   "modelSpec":  "盒装",
                                   "brand":  "延草纲目",
                                   "shortTitle":  "y",
                                   "title":  "x",
                                   "spu":  "晋械注准20232090177"
                               },
                  "headless":  false,
                  "productFolder":  "C:\\Users\\ffc\\Desktop\\20260330自动上架\\02延草纲目健康护理专营店\\001宝元堂医用疼痛凝胶-红盒",
                  "retryOnSystemError":  true,
                  "shopFolder":  "C:\\Users\\ffc\\Desktop\\20260330自动上架\\02延草纲目健康护理专营店",
                  "mode":  "query_platform_spu"
              },
    "taskType":  "publish_from_spu",
    "runtimeDir":  "C:\\Users\\ffc\\.openclaw\\workspace\\douyin-title-generator\\data\\tasks\\real-product-query-spu",
    "taskId":  "real-product-query-spu",
    "resultFile":  "C:\\Users\\ffc\\.openclaw\\workspace\\douyin-title-generator\\data\\tasks\\real-product-query-spu\\result.json"
}