{
  "taskType": "publish_from_spu",
  "taskId": "real-product-flow-query",
  "runtimeDir": "C:\\Users\\ffc\\.openclaw\\workspace\\douyin-title-generator\\data\\tasks\\real-product-flow-query",
  "resultFile": "C:\\Users\\ffc\\.openclaw\\workspace\\douyin-title-generator\\data\\tasks\\real-product-flow-query\\result.json",
  "input": {
    "shopFolder": "C:\\Users\\ffc\\Desktop\\20260330自动上架\\02延草纲目健康护理专营店",
    "productFolder": "C:\\Users\\ffc\\Desktop\\20260330自动上架\\02延草纲目健康护理专营店\\001宝元堂医用疼痛凝胶-红盒",
    "mode": "run_publish_flow",
    "metadata": {
      "brand": "延草纲目",
      "spu": "晋械注准20232090177",
      "title": "x",
      "shortTitle": "y",
      "modelSpec": "盒装"
    },
    "headless": false,
    "retryOnSystemError": true
  }
}
