{
  "taskType": "doubao.run",
  "taskId": "doubao-demo-001",
  "runtimeDir": "C:\\Users\\ffc\\.openclaw\\workspace\\douyin-title-generator\\data\\tasks\\doubao-demo-001",
  "resultFile": "C:\\Users\\ffc\\.openclaw\\workspace\\douyin-title-generator\\data\\tasks\\doubao-demo-001\\result.json",
  "input": {
    "promptFile": "C:\\Users\\ffc\\.openclaw\\workspace\\douyin-title-generator\\input\\doubao-prompt.txt",
    "imageDir": "C:\\Users\\ffc\\.openclaw\\workspace\\douyin-title-generator\\input\\images",
    "outputDir": "C:\\Users\\ffc\\.openclaw\\workspace\\douyin-title-generator\\output",
    "titleCount": 12,
    "cleanupOutputDir": true
  }
}
