{
    "input":  {
                  "headless":  false,
                  "productFolder":  "C:\\Users\\ffc\\Desktop\\20260330自动上架\\02延草纲目健康护理专营店\\001宝元堂医用疼痛凝胶-红盒",
                  "retryOnSystemError":  true,
                  "shopFolder":  "C:\\Users\\ffc\\Desktop\\20260330自动上架\\02延草纲目健康护理专营店",
                  "metadata":  {
                                   "modelSpec":  "盒装",
                                   "brand":  "延草纲目",
                                   "shortTitle":  "byt医用疼痛凝胶-红盒",
                                   "title":  "宝元堂医用疼痛凝胶宝元堂正品筋骨康凝胶颈椎部位型远红外陶瓷粉远红外理疗技术肩周腰椎膝盖部位型医用凝胶延草纲目医用疼痛凝胶",
                                   "spu":  "晋械注准20232090177"
                               }
              },
    "taskType":  "publish_from_spu",
    "runtimeDir":  "C:\\Users\\ffc\\.openclaw\\workspace\\douyin-title-generator\\data\\tasks\\real-product-with-meta",
    "taskId":  "real-product-with-meta",
    "resultFile":  "C:\\Users\\ffc\\.openclaw\\workspace\\douyin-title-generator\\data\\tasks\\real-product-with-meta\\result.json"
}