{
  "taskType": "publish_from_spu",
  "taskId": "real-product-flow-inspect",
  "runtimeDir": "C:\\Users\\ffc\\.openclaw\\workspace\\douyin-title-generator\\data\\tasks\\real-product-flow-inspect",
  "resultFile": "C:\\Users\\ffc\\.openclaw\\workspace\\douyin-title-generator\\data\\tasks\\real-product-flow-inspect\\result.json",
  "input": {
    "shopFolder": "C:\\Users\\ffc\\Desktop\\20260330自动上架\\02延草纲目健康护理专营店",
    "productFolder": "C:\\Users\\ffc\\Desktop\\20260330自动上架\\02延草纲目健康护理专营店\\001宝元堂医用疼痛凝胶-红盒",
    "mode": "run_publish_flow",
    "publishPageUrl": "https://fxg.jinritemai.com/ffa/g/create?fast_publish=6&spu_id=7477827597263831311&btm_ppre=a2427.b39372.c67909.d0&btm_pre=a2427.b6805.c74711.d36179_d79961&btm_show_id=7d2131b4-5274-4ec6-84e9-eafe8300caf5",
    "metadata": {
      "title": "宝元堂医用疼痛凝胶红盒远红外磁疗舒痛贴",
      "shortTitle": "宝元堂医用疼痛凝胶红盒",
      "modelSpec": "盒装"
    },
    "headless": false,
    "retryOnSystemError": true
  }
}
