{
    "input":  {
                  "mode":  "open_platform_spu",
                  "headless":  false,
                  "productFolder":  "C:\\Users\\ffc\\Desktop\\20260330自动上架\\02延草纲目健康护理专营店\\001宝元堂医用疼痛凝胶-红盒",
                  "shopFolder":  "C:\\Users\\ffc\\Desktop\\20260330自动上架\\02延草纲目健康护理专营店",
                  "retryOnSystemError":  true
              },
    "taskType":  "publish_from_spu",
    "runtimeDir":  "C:\\Users\\ffc\\.openclaw\\workspace\\douyin-title-generator\\data\\tasks\\real-product-open-spu",
    "taskId":  "real-product-open-spu",
    "resultFile":  "C:\\Users\\ffc\\.openclaw\\workspace\\douyin-title-generator\\data\\tasks\\real-product-open-spu\\result.json"
}